{
  "$schema": "./stage-catalog.schema.json",
  "version": "v7-stage-catalog-1",
  "contract": "card-shop-v7-candidate/1",
  "policyVersion": "v7-stage-policy-1",
  "stages": [
    {
      "ordinal": 0,
      "stageId": "stage-00",
      "productId": "yijiang",
      "productName": "一将成名",
      "challengerId": "challenger-initial",
      "personId": "specialist-initial",
      "appearanceId": "bd-tomori",
      "displayName": "初始供货",
      "dueDay": 0,
      "formatId": "bo3",
      "tierId": "entry",
      "unlockedInitially": true,
      "description": "唯一初始供货主题，开局自动解锁并赠送1盒。"
    },
    {
      "ordinal": 1,
      "stageId": "stage-01",
      "productId": "refresh",
      "productName": "界限突破",
      "challengerId": "challenger-tomori",
      "personId": "specialist-tomori",
      "appearanceId": "bd-tomori",
      "displayName": "高松灯",
      "dueDay": 3,
      "formatId": "bo3",
      "tierId": "standard",
      "unlockedInitially": false,
      "description": "第1阶段挑战高手，获胜解锁界限突破卡包供货与招募高松灯。"
    },
    {
      "ordinal": 2,
      "stageId": "stage-02",
      "productId": "sp",
      "productName": "璀璨星河",
      "challengerId": "challenger-anon",
      "personId": "specialist-anon",
      "appearanceId": "bd-anon",
      "displayName": "千早爱音",
      "dueDay": 6,
      "formatId": "bo3",
      "tierId": "standard",
      "unlockedInitially": false,
      "description": "第2阶段挑战高手，获胜解锁璀璨星河卡包供货与招募千早爱音。"
    },
    {
      "ordinal": 3,
      "stageId": "stage-03",
      "productId": "tw",
      "productName": "外服武将",
      "challengerId": "challenger-rana",
      "personId": "specialist-rana",
      "appearanceId": "bd-rana",
      "displayName": "要乐奈",
      "dueDay": 9,
      "formatId": "bo3",
      "tierId": "standard",
      "unlockedInitially": false,
      "description": "第3阶段挑战高手，获胜解锁外服武将卡包供货与招募要乐奈。"
    },
    {
      "ordinal": 4,
      "stageId": "stage-04",
      "productId": "mobile",
      "productName": "移动版",
      "challengerId": "challenger-soyo",
      "personId": "specialist-soyo",
      "appearanceId": "bd-soyo",
      "displayName": "长崎素世",
      "dueDay": 12,
      "formatId": "bo3",
      "tierId": "standard",
      "unlockedInitially": false,
      "description": "第4阶段挑战高手，获胜解锁移动版卡包供货与招募长崎素世。"
    },
    {
      "ordinal": 5,
      "stageId": "stage-05",
      "productId": "huicui",
      "productName": "群英荟萃",
      "challengerId": "challenger-taki",
      "personId": "specialist-taki",
      "appearanceId": "bd-taki",
      "displayName": "椎名立希",
      "dueDay": 15,
      "formatId": "bo3",
      "tierId": "standard",
      "unlockedInitially": false,
      "description": "第5阶段挑战高手，获胜解锁群英荟萃卡包供货与招募椎名立希。"
    },
    {
      "ordinal": 6,
      "stageId": "stage-06",
      "productId": "sp2",
      "productName": "系列专属",
      "challengerId": "challenger-uika",
      "personId": "specialist-uika",
      "appearanceId": "bd-uika",
      "displayName": "三角初华",
      "dueDay": 18,
      "formatId": "bo3",
      "tierId": "standard",
      "unlockedInitially": false,
      "description": "第6阶段挑战高手，获胜解锁系列专属卡包供货与招募三角初华。"
    },
    {
      "ordinal": 7,
      "stageId": "stage-07",
      "productId": "sb",
      "productName": "谋攻篇",
      "challengerId": "challenger-mutsumi",
      "personId": "specialist-mutsumi",
      "appearanceId": "bd-mutsumi",
      "displayName": "若叶睦",
      "dueDay": 21,
      "formatId": "bo3",
      "tierId": "standard",
      "unlockedInitially": false,
      "description": "第7阶段挑战高手，获胜解锁谋攻篇卡包供货与招募若叶睦。"
    },
    {
      "ordinal": 8,
      "stageId": "stage-08",
      "productId": "jsrg",
      "productName": "江山如故",
      "challengerId": "challenger-umiri",
      "personId": "specialist-umiri",
      "appearanceId": "bd-umiri",
      "displayName": "八幡海铃",
      "dueDay": 24,
      "formatId": "bo3",
      "tierId": "standard",
      "unlockedInitially": false,
      "description": "第8阶段挑战高手，获胜解锁江山如故卡包供货与招募八幡海铃。"
    },
    {
      "ordinal": 9,
      "stageId": "stage-09",
      "productId": "shiji",
      "productName": "始计篇",
      "challengerId": "challenger-nyamu",
      "personId": "specialist-nyamu",
      "appearanceId": "bd-nyamu",
      "displayName": "祐天寺若麦",
      "dueDay": 27,
      "formatId": "bo3",
      "tierId": "standard",
      "unlockedInitially": false,
      "description": "第9阶段挑战高手，获胜解锁始计篇卡包供货与招募祐天寺若麦。"
    },
    {
      "ordinal": 10,
      "stageId": "stage-10",
      "productId": "shenhua",
      "productName": "神话再临",
      "challengerId": "challenger-sakiko",
      "personId": "specialist-sakiko",
      "appearanceId": "bd-sakiko",
      "displayName": "丰川祥子",
      "dueDay": 30,
      "formatId": "bo3",
      "tierId": "standard",
      "unlockedInitially": false,
      "description": "第10阶段挑战高手，获胜解锁神话再临卡包供货与招募丰川祥子。"
    },
    {
      "ordinal": 11,
      "stageId": "stage-11",
      "productId": "yingbian",
      "productName": "文德武备",
      "challengerId": "challenger-ritsu",
      "personId": "specialist-ritsu",
      "appearanceId": "bd-ritsu",
      "displayName": "峰月律",
      "dueDay": 33,
      "formatId": "bo3",
      "tierId": "standard",
      "unlockedInitially": false,
      "description": "第11阶段挑战高手，获胜解锁文德武备卡包供货与招募峰月律。"
    },
    {
      "ordinal": 12,
      "stageId": "stage-12",
      "productId": "sxrm",
      "productName": "蚀心入魔",
      "challengerId": "challenger-miyako",
      "personId": "specialist-miyako",
      "appearanceId": "bd-miyako",
      "displayName": "藤都子",
      "dueDay": 36,
      "formatId": "bo3",
      "tierId": "standard",
      "unlockedInitially": false,
      "description": "第12阶段挑战高手，获胜解锁蚀心入魔卡包供货与招募藤都子。"
    },
    {
      "ordinal": 13,
      "stageId": "stage-13",
      "productId": "clan",
      "productName": "门阀士族",
      "challengerId": "challenger-yuno",
      "personId": "specialist-yuno",
      "appearanceId": "bd-yuno",
      "displayName": "千石由乃",
      "dueDay": 39,
      "formatId": "bo3",
      "tierId": "standard",
      "unlockedInitially": false,
      "description": "第13阶段挑战高手，获胜解锁门阀士族卡包供货与招募千石由乃。"
    },
    {
      "ordinal": 14,
      "stageId": "stage-14",
      "productId": "bingshi",
      "productName": "兵势篇",
      "challengerId": "challenger-nagi",
      "personId": "specialist-nagi",
      "appearanceId": "bd-nagi",
      "displayName": "琴平凪",
      "dueDay": 42,
      "formatId": "bo3",
      "tierId": "expert",
      "unlockedInitially": false,
      "description": "第14阶段挑战高手，获胜解锁兵势篇卡包供货与招募琴平凪。"
    },
    {
      "ordinal": 15,
      "stageId": "stage-15",
      "productId": "extra",
      "productName": "经典神将",
      "challengerId": "challenger-hotaru",
      "personId": "specialist-hotaru",
      "appearanceId": "bd-hotaru",
      "displayName": "汐见萤",
      "dueDay": 45,
      "formatId": "bo3",
      "tierId": "expert",
      "unlockedInitially": false,
      "description": "第15阶段挑战高手，获胜解锁经典神将卡包供货与招募汐见萤。"
    }
  ]
}